{
  "meta": {
    "version": "2.0",
    "outputMode": "proposal_single",
    "outputModeReason": "顧客が記帳代行を明確に希望、太陽光発電所の維持管理目的でサービス構成がシンプル",
    "outputPath": "G:\\共有ドライブ\\06_見込み客\\20260325_BANGKOK_SOLAR\\税務顧問サービスのご提案_あしたの会計事務所_株式会社企業経営サポート宮崎.docx",
    "generatedAt": "2026-03-27T10:00:00+09:00"
  },

  "client": {
    "name": "株式会社企業経営サポート宮崎",
    "honorific": "御中",
    "industry": "太陽光発電事業",
    "businessDescription": "宮崎県にて太陽光発電所を所有・運営する売電事業。2025年12月に買収。4月決算。",
    "fiscalMonth": 4,
    "annualRevenue": 35000000,
    "annualRevenueNote": "年商約3,500万円（PDF準拠、Cクラス扱い）",
    "monthlyTransactions": 50,
    "salesClass": "C",
    "requiresManualPricing": false
  },

  "proposal": {
    "date": "2026-03-27",
    "introduction": {
      "useDefault": false,
      "customParagraphs": [
        "先日は顧問契約に関するご相談を賜り、誠にありがとうございました。お打ち合わせの内容を踏まえ、貴社の事業内容・規模に最適化した税務顧問サービスをご提案いたします。",
        "貴社は2025年12月に買収され、宮崎県にて太陽光発電所を所有・運営する売電事業を展開されております。年商約2,000万円で、4月決算の会社と伺っております。",
        "現在の税理士による2026年4月決算の完了後、2026年5月からの新期より弊社がサポートを開始いたします。円滑な引継ぎと安定した経理体制の構築をお約束いたします。"
      ]
    }
  },

  "challenges": [
    {
      "id": "ch01",
      "title": "買収後の税理士変更・引継ぎ対応",
      "detail": "2025年12月の買収後、現税理士による2026年4月期の決算完了を待って引継ぎを行います。前期の帳簿・税務データを確実に引き継ぎ、新期からスムーズに記帳を開始いたします。",
      "linkedServiceIds": ["sv01", "sv06"]
    },
    {
      "id": "ch02",
      "title": "固定資産の減価償却管理",
      "detail": "太陽光発電設備の減価償却について、買収時の取得価額・償却スケジュールを正確に引き継ぎ、適正な処理を継続いたします。",
      "linkedServiceIds": ["sv01", "sv02"]
    },
    {
      "id": "ch03",
      "title": "課税事業者判定の確認",
      "detail": "課税事業者であるかどうかの確認が必要です。基準期間の課税売上高に基づき、消費税の申告義務の有無を判定いたします。",
      "linkedServiceIds": ["sv03"]
    },
    {
      "id": "ch04",
      "title": "将来の売却を見据えた税務対応",
      "detail": "将来的に会社ごとの売却が想定されるため、帳簿の正確性を維持し、売却時にスムーズな対応ができる体制を整えます。",
      "linkedServiceIds": ["sv01", "sv02"]
    }
  ],

  "services": [
    { "id": "sv01", "name": "記帳代行・月次レビュー", "detail": "freeeを活用した記帳代行。3ヶ月ごとに試算表を作成・納品し、異常値をチェック。" },
    { "id": "sv02", "name": "決算申告", "detail": "法人税・消費税・地方税の確定申告書作成・提出まで一貫対応。決算報告書の作成。" },
    { "id": "sv03", "name": "消費税対応", "detail": "課税事業者の場合、原則課税に基づく消費税申告、インボイス対応。" },
    { "id": "sv04", "name": "償却資産申告", "detail": "各自治体への償却資産申告書の作成・提出代行。" },
    { "id": "sv05", "name": "freee導入支援", "detail": "アカウント設定・口座連携・勘定科目マッピングの初期設定。" },
    { "id": "sv06", "name": "税務届出・手続代行", "detail": "税理士変更届、納税関連の各種手続き等を代行。納税額のお知らせも含みます。" }
  ],

  "pricing": {
    "selectedModules": {
      "bookkeeping": true,
      "selfBookkeeping": false,
      "consultation": false
    },
    "manualPricing": { "enabled": false },
    "deliveryFrequency": "every3months",
    "automaticDiscounts": {
      "bankSync": false,
      "creditCardSync": false,
      "freeeHRUse": false,
      "cashBookManual": false
    },
    "manualDiscounts": {
      "introduction": { "monthly": 0, "annual": 0 },
      "volume": {
        "monthly": -5000,
        "monthlyReason": "取引先数・仕訳数が少量のため",
        "annual": -60000,
        "annualReason": "取引先数・仕訳数が少量のため"
      }
    },
    "annualOptions": {
      "yearEndAdjustment": { "enabled": false, "people": 0 },
      "statutoryReports": { "enabled": true, "sheets": 5 },
      "salaryReport": { "enabled": false, "municipalities": 0 },
      "fixedAssetReport": { "enabled": true },
      "englishFS": { "enabled": true },
      "auditSupport": { "enabled": false }
    },
    "consumptionTaxMethod": "principle",
    "notes": [
      "消費税の課税事業者判定は、基準期間の課税売上高を確認の上で最終確定いたします。免税事業者の場合、消費税等申告報酬は不要となります。",
      "消費税の計算方法が簡易課税の場合、消費税等申告報酬は30,000円（税別）となります。",
      "償却資産申告の報酬は経理サポートに含まれております。"
    ]
  },

  "contractFlow": {
    "useDefault": false,
    "customSteps": [
      { "step": 1, "content": "本提案書のご確認・ご契約", "note": "内容にご同意いただければ契約へ。" },
      { "step": 2, "content": "履歴事項全部証明書PDFのご提供", "note": "貴社にてご手配をお願いいたします。" },
      { "step": 3, "content": "顧問契約書の締結", "note": "当事務所よりドラフトをお送りします。" },
      { "step": 4, "content": "2026年4月期決算完了後、前任税理士からのデータ引継ぎ", "note": "帳簿・税務データ等の移管を進めます。" },
      { "step": 5, "content": "freeeアカウント設定・連携", "note": "口座連携・勘定科目マッピングを設定。" },
      { "step": 6, "content": "2026年5月分からの記帳開始", "note": "新期の資料をご提出いただき、記帳を開始します。" },
      { "step": 7, "content": "継続的な記帳・3ヶ月ごとの試算表納品", "note": "以降、定期的な記帳・レビューを継続します。" }
    ]
  }
}
