{
  "meta": {
    "version": "2.0",
    "outputMode": "proposal_single",
    "outputModeReason": "顧客が記帳代行を明確に希望しており、サービス構成がシンプルなため単一プラン提案",
    "outputPath": "G:\\共有ドライブ\\06_見込み客\\20260325_BANGKOK_SOLAR\\税務顧問サービスのご提案_あしたの会計事務所_MegaSolar1456EC合同会社.docx",
    "generatedAt": "2026-03-27T10:00:00+09:00"
  },

  "client": {
    "name": "MegaSolar1456EC合同会社",
    "honorific": "御中",
    "industry": "太陽光発電事業",
    "businessDescription": "岡山県にて太陽光発電所を所有・運営する売電事業",
    "fiscalMonth": 3,
    "annualRevenue": 60000000,
    "annualRevenueNote": "年商約6,000万円。PDF記載: 売上1億未満の料金で見積り",
    "monthlyTransactions": 30,
    "salesClass": "D",
    "requiresManualPricing": false
  },

  "proposal": {
    "date": "2026-03-27",
    "introduction": {
      "useDefault": false,
      "customParagraphs": [
        "先日は顧問契約に関するご相談を賜り、誠にありがとうございました。お打ち合わせの内容を踏まえ、貴社の事業内容・規模に最適化した税務顧問サービスをご提案いたします。",
        "貴社は岡山県にて太陽光発電所を所有・運営され、年商約6,000万円の売電事業を展開されております。取引構造がシンプルであり、安定した事業運営を継続されていらっしゃいます。",
        "税理士変更に伴う円滑な引継ぎはもちろん、日々の記帳代行から決算申告まで、貴社のバックオフィス業務を責任をもってサポートいたします。"
      ]
    }
  },

  "challenges": [
    {
      "id": "ch01",
      "title": "税理士変更に伴う引継ぎ対応",
      "detail": "前任税理士からの帳簿・税務データの引継ぎを円滑に進め、2026年1月分からの記帳を速やかに開始いたします。",
      "linkedServiceIds": ["sv01", "sv06"]
    },
    {
      "id": "ch02",
      "title": "固定資産の減価償却管理",
      "detail": "太陽光発電設備の減価償却について、既存の償却スケジュールを正確に引き継ぎ、適正な処理を継続いたします。",
      "linkedServiceIds": ["sv01", "sv02"]
    },
    {
      "id": "ch03",
      "title": "将来の売却を見据えた税務対応",
      "detail": "将来的に会社ごとの売却が想定されるため、帳簿の正確性を維持し、売却時にスムーズなデューデリジェンス対応ができる体制を整えます。",
      "linkedServiceIds": ["sv01", "sv02"]
    }
  ],

  "services": [
    { "id": "sv01", "name": "記帳代行・月次レビュー", "detail": "freeeを活用した記帳代行。3ヶ月ごとに試算表を作成・納品し、異常値をチェック。" },
    { "id": "sv02", "name": "決算申告", "detail": "法人税・消費税・地方税の確定申告書作成・提出まで一貫対応。決算報告書の作成。" },
    { "id": "sv03", "name": "消費税対応", "detail": "原則課税に基づく消費税申告、インボイス対応。" },
    { "id": "sv04", "name": "償却資産申告", "detail": "各自治体への償却資産申告書の作成・提出代行。" },
    { "id": "sv05", "name": "freee導入支援", "detail": "アカウント設定・口座連携・勘定科目マッピングの初期設定。" },
    { "id": "sv06", "name": "税務届出・手続代行", "detail": "税理士変更届、納税関連の各種手続き等を代行。納税額のお知らせも含みます。" }
  ],

  "pricing": {
    "selectedModules": {
      "bookkeeping": true,
      "selfBookkeeping": false,
      "consultation": false
    },
    "manualPricing": { "enabled": false },
    "deliveryFrequency": "every3months",
    "automaticDiscounts": {
      "bankSync": false,
      "creditCardSync": false,
      "freeeHRUse": false,
      "cashBookManual": false
    },
    "manualDiscounts": {
      "introduction": { "monthly": 0, "annual": 0 },
      "volume": {
        "monthly": -5000,
        "monthlyReason": "取引先数・仕訳数が少量のため",
        "annual": -50000,
        "annualReason": "取引先数・仕訳数が少量のため"
      }
    },
    "annualOptions": {
      "yearEndAdjustment": { "enabled": false, "people": 0 },
      "statutoryReports": { "enabled": true, "sheets": 5 },
      "salaryReport": { "enabled": false, "municipalities": 0 },
      "fixedAssetReport": { "enabled": true },
      "englishFS": { "enabled": true },
      "auditSupport": { "enabled": false }
    },
    "consumptionTaxMethod": "principle",
    "notes": [
      "消費税の計算方法が簡易課税の場合、消費税等申告報酬は30,000円（税別）となります。",
      "償却資産申告の報酬は経理サポートに含まれております。",
      "売上規模は1億円未満を基準としておりますが、仕訳数が月30件以下と少量であることを考慮し、出精値引きを適用しております。"
    ]
  },

  "contractFlow": {
    "useDefault": false,
    "customSteps": [
      { "step": 1, "content": "本提案書のご確認・ご契約", "note": "内容にご同意いただければ契約へ。" },
      { "step": 2, "content": "履歴事項全部証明書PDFのご提供", "note": "貴社にてご手配をお願いいたします。" },
      { "step": 3, "content": "顧問契約書の締結", "note": "当事務所よりドラフトをお送りします。" },
      { "step": 4, "content": "前任税理士からのデータ引継ぎ", "note": "帳簿・税務データ等の移管を進めます。" },
      { "step": 5, "content": "freeeアカウント設定・連携", "note": "口座連携・勘定科目マッピングを設定。" },
      { "step": 6, "content": "2026年1月〜3月分の記帳開始", "note": "資料をご提出いただき、記帳を開始します。" },
      { "step": 7, "content": "継続的な記帳・3ヶ月ごとの試算表納品", "note": "以降、定期的な記帳・レビューを継続します。" }
    ]
  }
}
