{
  "meta": {
    "version": "2.0",
    "outputMode": "proposal_single",
    "outputModeReason": "休眠状態の会社で記帳代行の最小構成、単一プラン提案",
    "outputPath": "G:\\共有ドライブ\\06_見込み客\\20260325_BANGKOK_SOLAR\\税務顧問サービスのご提案_あしたの会計事務所_日本アンプル電力合同会社.docx",
    "generatedAt": "2026-03-27T10:00:00+09:00"
  },

  "client": {
    "name": "日本アンプル電力合同会社",
    "honorific": "御中",
    "industry": "小水力発電事業",
    "businessDescription": "小水力発電事業のために設立。現時点では事業未開始、取引ほぼなし。",
    "annualRevenue": 0,
    "annualRevenueNote": "事業未開始、取引ほぼなし",
    "monthlyTransactions": 5,
    "salesClass": "A",
    "requiresManualPricing": false
  },

  "proposal": {
    "date": "2026-03-27",
    "introduction": {
      "useDefault": false,
      "customParagraphs": [
        "先日は顧問契約に関するご相談を賜り、誠にありがとうございました。お打ち合わせの内容を踏まえ、貴社の現状に最適化した税務顧問サービスをご提案いたします。",
        "貴社は小水力発電事業のために設立されたものの、現時点では事業が本格稼働しておらず、取引もほとんど発生していない状況と伺っております。",
        "現状の維持管理に必要な最低限の記帳代行・決算申告をリーズナブルな価格でご提供し、将来の事業開始に備えた体制を整えます。"
      ]
    }
  },

  "challenges": [
    {
      "id": "ch01",
      "title": "税理士変更に伴う引継ぎ対応",
      "detail": "前任税理士からの帳簿・税務データの引継ぎを円滑に進め、2026年1月分からの記帳を速やかに開始いたします。",
      "linkedServiceIds": ["sv01", "sv04"]
    },
    {
      "id": "ch02",
      "title": "休眠状態の会社維持管理",
      "detail": "事業未開始の状態でも、法人としての決算申告義務があります。最小限のコストで適正な申告を継続いたします。",
      "linkedServiceIds": ["sv01", "sv02"]
    },
    {
      "id": "ch03",
      "title": "将来の小水力事業開始への備え",
      "detail": "小水力発電事業を開始される際には、設備投資に伴う会計処理、消費税の課税事業者届出等の対応が必要となります。事業開始時に速やかに対応できる体制を整えます。",
      "linkedServiceIds": ["sv02"]
    }
  ],

  "services": [
    { "id": "sv01", "name": "記帳代行・月次レビュー", "detail": "freeeを活用した記帳代行。6ヶ月ごとに試算表を作成・納品。" },
    { "id": "sv02", "name": "決算申告", "detail": "法人税・地方税の確定申告書作成・提出まで一貫対応。決算報告書の作成。" },
    { "id": "sv03", "name": "freee導入支援", "detail": "アカウント設定・口座連携・勘定科目マッピングの初期設定。" },
    { "id": "sv04", "name": "税務届出・手続代行", "detail": "税理士変更届、納税関連の各種手続き等を代行。" }
  ],

  "pricing": {
    "selectedModules": {
      "bookkeeping": true,
      "selfBookkeeping": false,
      "consultation": false
    },
    "manualPricing": { "enabled": false },
    "deliveryFrequency": "every6months",
    "automaticDiscounts": {
      "bankSync": false,
      "creditCardSync": false,
      "freeeHRUse": false,
      "cashBookManual": false
    },
    "manualDiscounts": {
      "introduction": { "monthly": 0, "annual": 0 },
      "volume": {
        "monthly": -5000,
        "monthlyReason": "事業未開始・取引ほぼなしのため",
        "annual": -40000,
        "annualReason": "事業未開始・取引ほぼなしのため"
      }
    },
    "annualOptions": {
      "yearEndAdjustment": { "enabled": false, "people": 0 },
      "statutoryReports": { "enabled": true, "sheets": 5 },
      "salaryReport": { "enabled": false, "municipalities": 0 },
      "fixedAssetReport": { "enabled": true },
      "englishFS": { "enabled": true },
      "auditSupport": { "enabled": false }
    },
    "consumptionTaxMethod": "principle",
    "notes": [
      "現在免税事業者のため、消費税等申告報酬は含まれておりません。課税事業者となった場合は別途申告報酬が発生します。",
      "事業開始に伴い取引量が増加した場合は、料金の見直しをご相談させていただきます。"
    ]
  },

  "contractFlow": {
    "useDefault": false,
    "customSteps": [
      { "step": 1, "content": "本提案書のご確認・ご契約", "note": "内容にご同意いただければ契約へ。" },
      { "step": 2, "content": "履歴事項全部証明書PDFのご提供", "note": "貴社にてご手配をお願いいたします。" },
      { "step": 3, "content": "顧問契約書の締結", "note": "当事務所よりドラフトをお送りします。" },
      { "step": 4, "content": "前任税理士からのデータ引継ぎ", "note": "帳簿・税務データ等の移管を進めます。" },
      { "step": 5, "content": "freeeアカウント設定・連携", "note": "口座連携・勘定科目マッピングを設定。" },
      { "step": 6, "content": "2026年1月〜6月分の記帳開始", "note": "資料をご提出いただき、記帳を開始します。" },
      { "step": 7, "content": "継続的な記帳・6ヶ月ごとの試算表納品", "note": "以降、定期的な記帳・レビューを継続します。" }
    ]
  }
}
